{
  "$schema": "../schema/courts.schema.json",
  "id": "instante-2022",
  "title": "Harta instanțelor și volumul lor de activitate, 2022",
  "publisher": "Consiliul Superior al Magistraturii",
  "period": "2022",
  "provenance": {
    "source": "csm-starea-justitiei-2022",
    "locator": "Raport privind starea justiției în anul 2022, Anexa 1",
    "confidence": "verbatim"
  },
  "nationalAverages": {
    "byTier": [
      {
        "tier": "curte-de-apel",
        "perJudge": 671.9,
        "perPost": 595.2
      },
      {
        "tier": "iccj",
        "perJudge": 955.7,
        "perPost": 792.5
      },
      {
        "tier": "judecatorie",
        "perJudge": 1159.3,
        "perPost": 893.1
      },
      {
        "tier": "tribunal",
        "perJudge": 871.7,
        "perPost": 656.6
      }
    ]
  },
  "courts": [
    {
      "id": "iccj",
      "name": "Înalta Curte de Casație și Justiție",
      "tier": "iccj",
      "volume": 22745,
      "resolved": 14142,
      "loadPerPost": 792.0,
      "loadPerJudge": 956.0,
      "judges": 23.8,
      "posts": 28.7,
      "provenance": {
        "source": "csm-starea-justitiei-2022",
        "locator": "Anexa 1, p. 150",
        "confidence": "verbatim"
      }
    },
    {
      "id": "curte-de-apel-alba-iulia",
      "name": "Curtea de Apel ALBA IULIA",
      "tier": "curte-de-apel",
      "volume": 10475,
      "resolved": 6849,
      "loadPerPost": 571.9,
      "loadPerJudge": 716.7,
      "judges": 14.62,
      "posts": 18.32,
      "provenance": {
        "source": "csm-starea-justitiei-2022",
        "locator": "Anexa 1, p. 150, randul „Curtea de Apel ALBA IULIA”",
        "confidence": "verbatim",
        "note": "Volumul si cauzele solutionate sunt tiparite. Numarul de judecatori si schema sunt derivate: volum impartit la incarcatura pe judecator, respectiv pe schema."
      }
    },
    {
      "id": "curte-de-apel-bacau",
      "name": "Curtea de Apel BACAU",
      "tier": "curte-de-apel",
      "volume": 7043,
      "resolved": 5174,
      "loadPerPost": 487.6,
      "loadPerJudge": 590.1,
      "judges": 11.94,
      "posts": 14.44,
      "provenance": {
        "source": "csm-starea-justitiei-2022",
        "locator": "Anexa 1, p. 150, randul „Curtea de Apel BACAU”",
        "confidence": "verbatim",
        "note": "Volumul si cauzele solutionate sunt tiparite. Numarul de judecatori si schema sunt derivate: volum impartit la incarcatura pe judecator, respectiv pe schema."
      }
    },
    {
      "id": "curte-de-apel-brasov",
      "name": "Curtea de Apel BRASOV",
      "tier": "curte-de-apel",
      "volume": 7371,
      "resolved": 5519,
      "loadPerPost": 481.2,
      "loadPerJudge": 508.5,
      "judges": 14.5,
      "posts": 15.32,
      "provenance": {
        "source": "csm-starea-justitiei-2022",
        "locator": "Anexa 1, p. 150, randul „Curtea de Apel BRASOV”",
        "confidence": "verbatim",
        "note": "Volumul si cauzele solutionate sunt tiparite. Numarul de judecatori si schema sunt derivate: volum impartit la incarcatura pe judecator, respectiv pe schema."
      }
    },
    {
      "id": "curte-de-apel-bucuresti",
      "name": "Curtea de Apel BUCURESTI",
      "tier": "curte-de-apel",
      "volume": 69913,
      "resolved": 40966,
      "loadPerPost": 774.3,
      "loadPerJudge": 811.5,
      "judges": 86.15,
      "posts": 90.29,
      "provenance": {
        "source": "csm-starea-justitiei-2022",
        "locator": "Anexa 1, p. 150, randul „Curtea de Apel BUCURESTI”",
        "confidence": "verbatim",
        "note": "Volumul si cauzele solutionate sunt tiparite. Numarul de judecatori si schema sunt derivate: volum impartit la incarcatura pe judecator, respectiv pe schema."
      }
    },
    {
      "id": "curte-de-apel-cluj",
      "name": "Curtea de Apel CLUJ",
      "tier": "curte-de-apel",
      "volume": 13417,
      "resolved": 10118,
      "loadPerPost": 568.3,
      "loadPerJudge": 638.2,
      "judges": 21.02,
      "posts": 23.61,
      "provenance": {
        "source": "csm-starea-justitiei-2022",
        "locator": "Anexa 1, p. 150, randul „Curtea de Apel CLUJ”",
        "confidence": "verbatim",
        "note": "Volumul si cauzele solutionate sunt tiparite. Numarul de judecatori si schema sunt derivate: volum impartit la incarcatura pe judecator, respectiv pe schema."
      }
    },
    {
      "id": "curte-de-apel-constanta",
      "name": "Curtea de Apel CONSTANTA",
      "tier": "curte-de-apel",
      "volume": 10755,
      "resolved": 7784,
      "loadPerPost": 670.0,
      "loadPerJudge": 768.3,
      "judges": 14.0,
      "posts": 16.05,
      "provenance": {
        "source": "csm-starea-justitiei-2022",
        "locator": "Anexa 1, p. 150, randul „Curtea de Apel CONSTANTA”",
        "confidence": "verbatim",
        "note": "Volumul si cauzele solutionate sunt tiparite. Numarul de judecatori si schema sunt derivate: volum impartit la incarcatura pe judecator, respectiv pe schema."
      }
    },
    {
      "id": "curte-de-apel-craiova",
      "name": "Curtea de Apel CRAIOVA",
      "tier": "curte-de-apel",
      "volume": 17114,
      "resolved": 13272,
      "loadPerPost": 460.8,
      "loadPerJudge": 519.0,
      "judges": 32.97,
      "posts": 37.14,
      "provenance": {
        "source": "csm-starea-justitiei-2022",
        "locator": "Anexa 1, p. 150, randul „Curtea de Apel CRAIOVA”",
        "confidence": "verbatim",
        "note": "Volumul si cauzele solutionate sunt tiparite. Numarul de judecatori si schema sunt derivate: volum impartit la incarcatura pe judecator, respectiv pe schema."
      }
    },
    {
      "id": "curte-de-apel-galati",
      "name": "Curtea de Apel GALATI",
      "tier": "curte-de-apel",
      "volume": 8796,
      "resolved": 7024,
      "loadPerPost": 495.7,
      "loadPerJudge": 628.1,
      "judges": 14.0,
      "posts": 17.74,
      "provenance": {
        "source": "csm-starea-justitiei-2022",
        "locator": "Anexa 1, p. 150, randul „Curtea de Apel GALATI”",
        "confidence": "verbatim",
        "note": "Volumul si cauzele solutionate sunt tiparite. Numarul de judecatori si schema sunt derivate: volum impartit la incarcatura pe judecator, respectiv pe schema."
      }
    },
    {
      "id": "curte-de-apel-iasi",
      "name": "Curtea de Apel IASI",
      "tier": "curte-de-apel",
      "volume": 8345,
      "resolved": 6367,
      "loadPerPost": 489.1,
      "loadPerJudge": 512.4,
      "judges": 16.29,
      "posts": 17.06,
      "provenance": {
        "source": "csm-starea-justitiei-2022",
        "locator": "Anexa 1, p. 150, randul „Curtea de Apel IASI”",
        "confidence": "verbatim",
        "note": "Volumul si cauzele solutionate sunt tiparite. Numarul de judecatori si schema sunt derivate: volum impartit la incarcatura pe judecator, respectiv pe schema."
      }
    },
    {
      "id": "curte-de-apel-oradea",
      "name": "Curtea de Apel ORADEA",
      "tier": "curte-de-apel",
      "volume": 7232,
      "resolved": 5690,
      "loadPerPost": 489.7,
      "loadPerJudge": 582.3,
      "judges": 12.42,
      "posts": 14.77,
      "provenance": {
        "source": "csm-starea-justitiei-2022",
        "locator": "Anexa 1, p. 150, randul „Curtea de Apel ORADEA”",
        "confidence": "verbatim",
        "note": "Volumul si cauzele solutionate sunt tiparite. Numarul de judecatori si schema sunt derivate: volum impartit la incarcatura pe judecator, respectiv pe schema."
      }
    },
    {
      "id": "curte-de-apel-pitesti",
      "name": "Curtea de Apel PITESTI",
      "tier": "curte-de-apel",
      "volume": 14846,
      "resolved": 9640,
      "loadPerPost": 984.7,
      "loadPerJudge": 1227.2,
      "judges": 12.1,
      "posts": 15.08,
      "provenance": {
        "source": "csm-starea-justitiei-2022",
        "locator": "Anexa 1, p. 150, randul „Curtea de Apel PITESTI”",
        "confidence": "verbatim",
        "note": "Volumul si cauzele solutionate sunt tiparite. Numarul de judecatori si schema sunt derivate: volum impartit la incarcatura pe judecator, respectiv pe schema."
      }
    },
    {
      "id": "curte-de-apel-ploiesti",
      "name": "Curtea de Apel PLOIESTI",
      "tier": "curte-de-apel",
      "volume": 12719,
      "resolved": 9457,
      "loadPerPost": 596.4,
      "loadPerJudge": 718.7,
      "judges": 17.7,
      "posts": 21.33,
      "provenance": {
        "source": "csm-starea-justitiei-2022",
        "locator": "Anexa 1, p. 150, randul „Curtea de Apel PLOIESTI”",
        "confidence": "verbatim",
        "note": "Volumul si cauzele solutionate sunt tiparite. Numarul de judecatori si schema sunt derivate: volum impartit la incarcatura pe judecator, respectiv pe schema."
      }
    },
    {
      "id": "curte-de-apel-suceava",
      "name": "Curtea de Apel SUCEAVA",
      "tier": "curte-de-apel",
      "volume": 8276,
      "resolved": 6152,
      "loadPerPost": 475.1,
      "loadPerJudge": 615.1,
      "judges": 13.45,
      "posts": 17.42,
      "provenance": {
        "source": "csm-starea-justitiei-2022",
        "locator": "Anexa 1, p. 150, randul „Curtea de Apel SUCEAVA”",
        "confidence": "verbatim",
        "note": "Volumul si cauzele solutionate sunt tiparite. Numarul de judecatori si schema sunt derivate: volum impartit la incarcatura pe judecator, respectiv pe schema."
      }
    },
    {
      "id": "curte-de-apel-targu-mures",
      "name": "Curtea de Apel TARGU MURES",
      "tier": "curte-de-apel",
      "volume": 4720,
      "resolved": 3694,
      "loadPerPost": 382.6,
      "loadPerJudge": 416.7,
      "judges": 11.33,
      "posts": 12.34,
      "provenance": {
        "source": "csm-starea-justitiei-2022",
        "locator": "Anexa 1, p. 150, randul „Curtea de Apel TARGU MURES”",
        "confidence": "verbatim",